{"coverage":{"actions_covered":3,"actions_declared":5,"limitations":["Software evidence signed by an installation key: there is no TEE, no TPM and no hardware root of trust behind any claim here.","The envelope proves these sections were signed together. It does not prove the actions happened, and it cannot prove that an action absent from both the decisions and the uncovered list was never taken.","The grant chain is carried, not evaluated: whether each link attenuates its parent and was live at decision time is a verifier's question, and no verifier ships in this slice."],"uncovered":[{"action":"repo.push","reason":"the action was recorded in the run journal with no governance decision beside it"},{"action":"net.fetch:proxy","reason":"the decision was made before this envelope's window opened"}]},"decisions":[{"action":"repo.read","decision_id":"d1","grant_id":"grant-worker","inputs_hash":"sha256:2b00724afbfc339532687503ccab62c6c36d973af67037f43fa9cd03cb35ca45","journal_entry_hash":"sha256:8d29ddaa7517d06c1744050087140b22c28a73bc0b785201db1718308801f01b","policy":{"bundle_hash":"sha256:286015030b041db3fe66b5f435196dad1ad451c9ed32492e12eba2dc8831a67f","id":"bernstein.default-gate","version":"2026.08.1"},"run_id":"fixture-run","subject":"spiffe://bernstein.run/install/evidence-fixture/worker/1","timestamp":1700000001,"verdict":"allow"},{"action":"repo.write","decision_id":"d2","grant_id":"grant-worker","inputs_hash":"sha256:485c15bd30e3435a4bde96cb646a41c26335e5ed2f2027006caa14c9c42de430","journal_entry_hash":"sha256:bbbd9e67f9bda03bb27afc3279938d5c3a3836008951fd587b8fa12d4a2fdfde","policy":{"bundle_hash":"sha256:286015030b041db3fe66b5f435196dad1ad451c9ed32492e12eba2dc8831a67f","id":"bernstein.default-gate","version":"2026.08.1"},"run_id":"fixture-run","subject":"spiffe://bernstein.run/install/evidence-fixture/worker/1","timestamp":1700000002,"verdict":"allow"},{"action":"net.fetch","decision_id":"d3","grant_id":null,"inputs_hash":"sha256:e65835f654ffe838f237fd19931ee6f387c76881c47a03debee1899fdbbcb37b","journal_entry_hash":"sha256:5d716ede34937741883fa6467b95392fae22b9ce2ae010772491a52b3659c0e4","policy":{"bundle_hash":"sha256:286015030b041db3fe66b5f435196dad1ad451c9ed32492e12eba2dc8831a67f","id":"bernstein.default-gate","version":"2026.08.1"},"run_id":"fixture-run","subject":"spiffe://bernstein.run/install/evidence-fixture/worker/1","timestamp":1700000003,"verdict":"deny"}],"envelope_type":"https://bernstein.run/attestations/evidence-envelope/v1","evidence":[{"decision_id":"d1","digest":{"alg":"sha256","value":"cdcd61ba968b8adeb75dfb6649c86c3a57f16a4cf5f8232911fb287f2ccdaf83"},"kind":"spine_entry","locator":".sdd/runs/fixture-run/spine.jsonl#3"},{"decision_id":"d2","digest":{"alg":"sha256","value":"19b1f74e666ee7447cd5107d77c2e14ab3d67298b63db2a9dcd70f40a4ccbab0"},"kind":"artifact","locator":".sdd/artifacts/fixture-run/patch.diff"},{"decision_id":"d3","digest":{"alg":"sha256","value":"cc85d7bed3b0e538266005f092e89e4c43d182f61a66ece10826f27f8abace6e"},"kind":"journal_entry","locator":".sdd/runs/fixture-run/journal.jsonl#11"}],"grants":[{"actions":["repo.read","repo.write","net.fetch"],"constraints_hash":"sha256:7558b656373b7b7b5520719a1999ae54d8668abf44e5565f8d11917c8053e19c","grant_id":"grant-root","issuer":"spiffe://bernstein.run/operator/fixture","not_after":1700086400,"parent_grant_id":null,"subject":"spiffe://bernstein.run/install/evidence-fixture"},{"actions":["repo.read","repo.write"],"constraints_hash":"sha256:5a461405903b130fd6e16db1b3b866b5a4bc2f04ac9ff1038db1b44a42c9ae8f","grant_id":"grant-worker","issuer":"spiffe://bernstein.run/install/evidence-fixture","not_after":1700003600,"parent_grant_id":"grant-root","subject":"spiffe://bernstein.run/install/evidence-fixture/worker/1"}],"principal":{"id":"spiffe://bernstein.run/install/evidence-fixture","key":{"crv":"Ed25519","kid":"install-evidencefixture01","kty":"OKP","x":"1i8Bah79Hk_feT60LNhEceG6nwzwTRKHtcxx9hYofLg"}},"schema_version":"1.0.0","signature":{"alg":"EdDSA","jws":"eyJhbGciOiJFZERTQSIsImtpZCI6Imluc3RhbGwtZXZpZGVuY2VmaXh0dXJlMDEiLCJ0eXAiOiJiZXJuc3RlaW4tZXZpZGVuY2UtZW52ZWxvcGUrandzIn0..UkTPGYKv9IBpVnWFOLn-W7atoqAUbSsttsO5qD83CvQXKr0XZEfIHllP57MTYSyz344DTUOCJCrwtdBTHO2OCA","kid":"install-evidencefixture01","typ":"bernstein-evidence-envelope+jws"}}